Entidad;Nit Entidad;Departamento Entidad;Ciudad Entidad;;
SECRETARÍA DE TRANSPORTE Y MOVILIDAD;899999114;Arauca;Arauca;;
ESE HOSPITAL FRANCISCO ELADIO BARRERA;890905097;Antioquia;Don Matías;;
ESTABLECIMIENTO PENITENCIARIO LA ESPERANZA DEL MUNICIPIO DE GUADUAS;900388272;Cundinamarca;Guaduas;;
CARCEL Y PENITENCIARIA DE MEDIA SEGURIDAD DE CHOCONTA;832001797;Cundinamarca;Chocontá;;
SECRETARIA DE LA MUJER Y EQUIDAD DE GENERO;899999114;Distrito Capital de Bogotá;Bogotá;;
ARMADA NACIONAL BASE NAVAL No. 6 ARC BOGOTA;800141644;Distrito Capital de Bogotá;Bogotá;;
INSTITUCIÓN EDUCATIVA JOSÉ FÉLIX DE RESTREPO VÉLEZ;811017572;Antioquia;Sabaneta;;
ALCALDIA DE MOCOA;800102891;No Definido;No Definido;;
RED SALUD ARMENIA EMPRESA SOCIAL DEL ESTADO E.S.E.;801001440;Quindío;Armenia;;
CENTRAL ADMINISTRATIVA Y CONTABLE - CENAC - ARMENIA;800130829;Quindío;Armenia;;
INSTITUCION EDUCATIVA NUESTRA SEÑORA DE GUADALUPE;8160008307;Risaralda;Dosquebradas;;
PERSONERIA MUNICIPAL DE CAJICA;899999465;Cundinamarca;Cajicá;;
COMISION PROFESIONAL COLOMBIANA DE DISEÑO INDUSTRIAL;900246895;Distrito Capital de Bogotá;Bogotá;;
HOSPITAL GENERAL DE MEDELLIN LUZ CASTRO DE GUTIERREZ ESE;890904646;No Definido;No Definido;;
DEPARTAMENTO POLICIA ARAUCA;800140602;Arauca;Arauca;;
MUNICIPIO DE TURMEQUE;891801787;No Definido;No Definido;;
CONTRALORIA GENERAL DE LA REPUBLICA-CGR- GERENCIA DEPARTAMENTAL CASANARE;899999067;Casanare;Yopal;;
ESTABLECIMIENTO PENITENCIARIO DE MEDIANA SEGURIDAD Y CARCELARIO DE ACACIAS;822004467;Meta;Acacías;;
CONTRALORIA MUNICIPAL DE YUMBO;800190982;No Definido;No Definido;;
ALCALDÍA MUNICIPAL DE GACHANTIVÁ;800020045;No Definido;No Definido;;
ESTABLECIMIENTO PENITENCIARIO Y CARCELARIO DE BARRANQUILLA;802004295;Atlántico;Barranquilla;;
INSTITUTO DE INVESTIGACIONES MARINAS Y COSTERAS JOSE BENITO VIVES DE ANDREIS;800250062;No Definido;No Definido;;
ESE HOSPITAL SAN JUAN DEL SUROESTE;800068653;Antioquia;Hispania;;
ESTABLECIMIENTO PENITENCIARIO DE MEDIANA SEGURIDAD Y CARCELARIO DEL LIBANO TOLIMA;809002634;Tolima;Líbano;;
MUNICIPIO DE PAEZ;800049508;Boyacá;Páez;;
DEPARTAMENTO DE POLICÍA URABÁ - UNIDAD PRESTADORA DE SALUD;800141103;Antioquia;Carepa;;
DIRECCIÓN TERRITORIAL GUAINIA MINISTERIO DEL TRABAJO;830115226;Guainía;Inírida;;
CONTRALORIA GENERAL DEL MUNICIPIO DE MANIZALES;800101441;Caldas;Manizales;;
HOSPITAL CENTRAL;830067597;Distrito Capital de Bogotá;Bogotá;;
CONTRALORIA MUNICIPAL DE ARMENIA QUINDIO;800215818;Quindío;Armenia;;
MUNICIPIO DE TASCO;891856131;Boyacá;Tasco;;
ALCALDIA DE SESQUILE;899999415;No Definido;No Definido;;
RESGUARDO INDIGENA ARHUACO DE LA SIERRA NEVADA;824002015;No Definido;No Definido;;
MUNICIPIO DE REMEDIOS;890984312;No Definido;No Definido;;
INSTITUTO MUNICIPAL DE TRANSITO Y TRANSPORTEDE SOLEDAD;802021451;Atlántico;Soledad;;
CORPORACIÓN AUTÓNOMA REGIONAL PARA LA DEFENSA DE LA MESETA DE BUCARAMANGA;890201573;Santander;Bucaramanga;;
ALCALDIA MUNICAL DE BRICEÑO BOYACA;800099721;Boyacá;Briceño;;
DISTRITO ESPECIAL INDUSTRIAL Y PORTUARIO DE BARRANQUILLA;890102018;No Definido;No Definido;;
FISCALÍA GENERAL DE LA NACIÓN REGIONAL ORINOQUÍA;800187645;Meta;Villavicencio;;
FISCALÍA GENERAL DE LA NACIÓN REGIONAL NORORIENTAL;800187569;Santander;Bucaramanga;;
SENA REGIONAL CALDAS CENTRO PARA LA FORMACION CAFETERA;899999034;Caldas;Manizales;;
ALCALDIA DE PALESTINA;891102764;No Definido;No Definido;;
ESE HOSPITAL SAN JUAN BOSCO;824000450;No Definido;No Definido;;
ESE HOSPITAL LOCAL SABANAS DE SAN ANGEL;819003599;No Definido;No Definido;;
CENTRO EDUCATIVO SIMON BOLIVAR;900241221;Córdoba;Puerto Libertador;;
ALCALDÍA LOCAL DE CHAPINERO - FONDO DE DESARROLLO LOCAL;899999061;Antioquia;Medellín;;
INSTITUCION EDUCATIVA DEPARTAMENTAL JOHN F. KENNEDY;890680030;Cundinamarca;Arbeláez;;
EMPRESA DE SERVICIOS PUBLICOS DOMICILIARIOS DE PUENTE NACIONAL - ACUAPUENTE S.A. E.S.P.;804009177;Santander;Puente Nacional;;
Rama Judicial  Dirección Seccional de Administración Judicial de Sincelejo;800165944;Sucre;Sincelejo;;
UNIDAD DE PLANEACION MINERO ENERGETICO;830000282;Distrito Capital de Bogotá;No Definido;;
CONCEJO DE JERICÓ ANTIOQUIA;890981069;Antioquia;No Definido;;
CONTRALORIA MUNICIPAL DE DOSQUEBRADAS;800150130;Risaralda;Dosquebradas;;
DIRECCION DE SANIDAD EJERCITO DISPENSARIO MEDICO YOPAL;830039670;Casanare;Yopal;;
UARIV-UNIDAD PARA LA ATENCION Y REPARACION INTEGRAL A LAS VICTIMAS;900490473;No Definido;No Definido;;
POLICIA METROPOLITANA DE BOGOTA;800140603;No Definido;No Definido;;
INSTITUTO NACIONAL DE CANCEROLOGIA ESE;899999092;Distrito Capital de Bogotá;Bogotá;;
INSTITUCION EDUCATIVA DEPARTAMENTAL SAN PEDRO;900291840;Cundinamarca;Caparrapí;;
ALCALDIA LOCAL DE TEUSAQUILLO (oficial);899999061;Distrito Capital de Bogotá;Bogotá;;
SENA REGIONAL ATLANTICO;899999034;No Definido;No Definido;;
INSTITUCION EDUCATIVA LOS ARRAYANES;814005544;Nariño;Córdoba;;
SENA REGIONAL HUILA Grupo Administrativo CEFA;899999034;Huila;Campoalegre;;
INSTITUTO DE DESARROLLO MUNICIPAL DE DOSQUEBRADAS;816005795;Risaralda;Dosquebradas;;
HOSPITAL ISMAEL ROLDAN VALENCIA;818001019;Distrito Capital de Bogotá;Bogotá;;
INSTITUCION EDUCATIVA RURAL DEPARTAMENTAL DE SUBIA;808003762;Cundinamarca;Silvania;;
ESE HOSPITAL DEPARTAMENTAL SAN JOSÉ DE   MARULANDA;890805260;No Definido;No Definido;;
COMPLEJO CARCELARIO Y PENITENCIARIO CON ALTA; MEDIA Y MÍNIMA SEGURIDAD DE BOGOTA COBOG INPEC;830032532;Distrito Capital de Bogotá;Bogotá;
CENTRAL ADMINISTRATIVA Y CONTABLE REGIONAL TOLEMAIDA - CENAC TOLEMAIDA;800131049;Cundinamarca;Nilo;;
ALCALDÍA DEL DISTRITO TURÍSTICO Y CULTURAL DE CARTAGENA DE INDIAS;890480184;Bolívar;Cartagena;;
PERSONERÍA MUNICIPAL DE PIEDECUESTA;890205383;Santander;Piedecuesta;;
MUNICIPIO DE TOCANCIPA;899999428;Cundinamarca;Tocancipá;;
ALCALDIA MUNICIPIO DE TOTORO;800031874;No Definido;No Definido;;
INSTITUTO DE INVESTIGACIONES AMBIENTALES DEL PACIFICO;818000156;Chocó;Quibdó;;
EMPRESA INDUSTRIAL Y COMERCIAL DEL ESTADO ADMINISTRADORA DEL MONOPOLIO RENTISTICO DE LOS JUEGOS DE SUERTE Y AZAR;900505060;Distrito Capital de Bogotá;No Definido;;
CENTRO DE FORMACION INTEGRAL PARA EL TRABAJO - CEFIT;811031876;Antioquia;Envigado;;
INSTITUCIÓN EDUCATIVA RAFAEL J MEJÍA;811019263;Antioquia;Sabaneta;;
CONTRALORIA GENERAL DEL DEPARTAMENTO DE RISARALDA;891411091;Risaralda;Pereira;;
ALCALDIA MUNICIPAL DE TURBACO BOLIVAR;890481149;No Definido;No Definido;;
Secretaria Distrital de Integración social...;8999990611;No Definido;No Definido;;
MUNICIPIO DE SANTIAGO DE CALI - SECRETARIA DE MOVILIDAD;890399011;Valle del Cauca;Cali;;
INSTITUCION EDUCATIVA TECNICA ALVARO MOLINA;900025525;Tolima;Chaparral;;
ALCALDIA MUNICIPIO DE LA PAZ;8902053083;No Definido;No Definido;;
MUNICIPIO EL COPEY;800096587;No Definido;No Definido;;
ALCALDIA MUNICIPAL DE CORDOBA;800038613;No Definido;No Definido;;
SENA REGIONAL HUILA Grupo Administrativo CADP;899999034;Huila;Garzón;;
SUPERINTENDENCIA DE NOTARIADO Y REGISTRO;899999007;Distrito Capital de Bogotá;No Definido;;
ALCALDIA MUNICIPIO DE JARDÍN;890982294;No Definido;No Definido;;
MUNICIPO DE VENTAQUEMADA;891800986;Boyacá;Ventaquemada;;
MUNICIPIO DE SUAITA;890204985;No Definido;No Definido;;
CENTRO DE DIAGNOSTICO AUTOMOTOR DEL VALLE LIMITADA;890311425;No Definido;No Definido;;
DIRECCION NACIONAL DE DERECHO DE AUTOR;800185929;Distrito Capital de Bogotá;No Definido;;
ALCALDIA MUNICIPAL DE SAMPUES SUCRE;892280055;Sucre;Sampués;;
INSTITUTO MUNICIPAL DE EDUCACION FISICA; DEPORTE Y RECREACION DE RIONEGRO;890985523;Antioquia;Rionegro;
CONCEJO MUNICIPAL CORRALES;891855748;Boyacá;No Definido;;
ESTABLECIMIENTO PENITENCIARIO Y CARCELARIO DE PACORA;810001336;Caldas;Pácora;;
COLEGIO ROBERTO GARCIA PEÑA;800228813;Santander;Girón;;
MINISTERIO DE RELACIONES EXTERIORES;899999042;Distrito Capital de Bogotá;Bogotá;;
ESTABLECIMIENTO PENITENCIARIO DE MEDIANA SEGURIDAD Y CARCELARIO LA CEJA;811010105;Distrito Capital de Bogotá;Bogotá;;
RESGUARDO INDIGENA CRISTIANIA;800224198;Antioquia;Jardín;;
ALCALDIA LOCAL DE TUNJUELITO;899999061;Distrito Capital de Bogotá;No Definido;;
POLICIA METROPOLITANA DE CUCUTA*;900259415;No Definido;No Definido;;
CONTRALORÍA MUNICIPAL DE TULUÁ;900623073;Valle del Cauca;Tuluá;;
CONTRALORIA GENERAL DE LA REPUBLICA -GERENCIA DEPARTAMENTAL VICHADA;899999067;Vichada;Puerto Carreño;;
CENTRAL DE INVERSIONES S. A. :);860042945;No Definido;No Definido;;
MINISTERIO DEL DEPORTE;899999306;Distrito Capital de Bogotá;Bogotá;;
EMPRESA SOCIAL DEL ESTADO DEL MUNICIPIO DE VILLAVICENCIO;822002459;Meta;Villavicencio;;
MUNICIPIO DE PACHAVITA;800028461;No Definido;No Definido;;
CONCEJO MUNICIPAL DE TURBO;841000125;Antioquia;Turbo;;
INSTITUTO NACIONAL DE MEDICINA LEGAL Y CIENCIAS FORENSES;800150861;No Definido;No Definido;;
HOSPITAL SAN ROQUE E.S.E DE GUACARI;891380046;Valle del Cauca;Guacarí;;
ALCALDÍA MUNICIPAL IQUIRA;891180131;No Definido;No Definido;;
ESTABLECIMIENTO PENITENCIARIO Y CARCELARIO  EL BANCO MAGDALENA;819001482;Distrito Capital de Bogotá;Bogotá;;
ALCALDIA MUNICIPIO DE RIONEGRO;890204646;Santander;Rionegro;;
SENA REGIONAL CHOCO Grupo de Apoyo Administrativo Mixto;899999034;Chocó;Quibdó;;
JURISDICCION ESPECIAL DE PAZ;901140004;No Definido;No Definido;;
INSTITUTO MUNICIPAL DE CULTURA; RECREACION; DEPORTE Y TURISMO DE CARTAGENA DEL CHAIRA;828002189;Caquetá;Cartagena Del Chairá
CONTRALORIA GENERAL DEL DEPARTAMENTO DEL MAGDALENA;891780092;Magdalena;Santa Marta;;
ESTABLECIMIENTO PENITENCIARIO Y CARCELARIO DE MEDIANA SEGURIDAD PITALITO - INPEC;813001834;Huila;Pitalito;;
ALCALDIA MUNICIPIO DE CUCAITA;891802089;Boyacá;Cucaita;;
CONTRALORIA DEPARTAMENTAL  DE NARIÑO;800157830;Nariño;Pasto;;
MUNICIPIO EL DONCELLO;800095760;Caquetá;El Doncello;;
POLICÍA NACIONAL - DIRECCIÓN ADMINISTRATIVA Y FINANCIERA;800141397;Distrito Capital de Bogotá;No Definido;;
COMPLEJO PENITENCIARIO Y CARCELARIO METROPOLITANO DE CUCUTA;900577112;Norte de Santander;Cúcuta;;
ALCALDIA MUNICIPAL FUSAGASUGA;890680008;No Definido;No Definido;;
MINISTERIO DE DEFENSA NACIONAL;899999003;Distrito Capital de Bogotá;Bogotá;;
MUNICIPIO DE VILLAGOMEZ;899999447;No Definido;No Definido;;
MUNICIPIO DE FLORENCIA;800095728;Caquetá;Florencia;;
CONTADURÍA GENERAL DE LA NACIÓN;830025406;Distrito Capital de Bogotá;Bogotá;;
INSTITUCION EDUCATIVA COSANZA;8130101025;Huila;Timaná;;
ALCALDIA MUNICIPAL DE VILLETA;899999312;Cundinamarca;Villeta;;
CENTRAL ADMINISTRATIVA Y CONTABLE  PUENTE ARANDA;830039548;Distrito Capital de Bogotá;Bogotá;;
ESTABLECIMIENTO PENITENCIARIO DE MEDIANA SEGURIDAD CARCELARIA DE SANTA BARBARA;811010109;Antioquia;Santa Bárbara;;
INSTITUTO DEPARTAMENTAL DE DEPORTES DE CÓRDOBA;812004130;Córdoba;Montería;;
ALCALDIA MUNICIPIO DE GIRON SANTANDER;890204802;Santander;Girón;;
ALCALDIA MUNICIPAL DE MORALES BOLIVAR;890480431;No Definido;No Definido;;
DEPARTAMENTO DE POLICIA CESAR - AREA DE SANIDAD;800140623;Cesar;Valledupar;;
MUNICIPIO DE PAJARITO;800065593;Boyacá;Pajarito;;
INSTITUTO NACIONAL DE VIGILANCIA DE MEDICAMENTOS Y ALIMENTOS;830000167;Arauca;Arauca;;
CONCEJO MUNICIPAL DE FUSAGASUGA;901184118;Cundinamarca;Fusagasugá;;
SUBRED INTEGRADA DE SERVICIOS DE SALUD SUR E.S.E;9009585649;No Definido;No Definido;;
EMPRESA DE SERVICIOS PÚBLICOS DOMICILIARIOS DE AMBALEMA E.S.P;809001459;Tolima;Ambalema;;
INSTITUTO MUNICIPAL DE EMPLEO Y FOMENTO EMPRESARIAL DE BUCARAMANGA;804014968;Santander;Bucaramanga;;
CARCEL Y PENITENCIERIA DE MEDIA SEGURIDAD DE CHIQUINQUIRA - INPEC;820000960;Boyacá;Chiquinquirá;;
UNIDAD PARA LAS VÍCTIMAS - FONDO PARA LA REPARACIÓN DE LAS VÍCTIMAS;900490473;Distrito Capital de Bogotá;No Definido;;
ALCALDIA MUNICIPAL DE PUERTO SALGAR;899999413;Cundinamarca;No Definido;;
ESTABLECIMIENTO PENITENCIARIO DE MEDIANA SEGURIDAD CARCELARIO SALAMINA;810001373;Caldas;Salamina;;
Rama Judicial  Dirección Seccional de Administración Judicial de Cartagena;800165831;Bolívar;Cartagena;;
ALCALDÍA MUNICIPAL DE RÁQUIRA;891801244;No Definido;No Definido;;
CORPORACION FRESNENSE DE OBRAS SANITARIAS;800123131;Tolima;Fresno;;
UNIDAD ADMINISTRATIVA ESPECIAL AGENCIA NACIONAL DE DEFENSA JURÍDICA DEL ESTADO;9005077411;Distrito Capital de Bogotá;Bogotá;;
COMISIÓN DE REGULACIÓN DE COMUNICACIONES;830002593;Distrito Capital de Bogotá;Bogotá;;
ALCALDIA MUNICIPIO DE MANZANARES;890802505;No Definido;No Definido;;
ARMADA DE COLOMBIA - COMANDO GUARDACOSTAS DEL AMAZONAS;838000055;Amazonas;Leticia;;
ALCALDIA MUNICIPIO DE LA VEGA;891500997;Cauca;La Vega;;
ESTABLECIMIENTO PENITENCIARIO DE MEDIANA SEGURIDAD Y CARCELARIO LA PLATA HUILA;813002057;Huila;Neiva;;
SECRETARIA DE INFRAESTRUCTURA Y VALORIZACION - GOBERNACION DEL VALLE;8903990295;Valle del Cauca;Cali;;
PERSONERIA DE SAN MARCOS  SUCRE;8230002295;Sucre;San Marcos;;
CENTRAL ADMINISTRATIVA Y CONTABLE REGIONAL ARMENIA-SANIDAD;830039670;Quindío;Armenia;;
MUNICIPIO DE TENJO;800095174;Cundinamarca;Tenjo;;
BATALLÓN DE APOYO Y SERVICIOS PARA EL COMBATE N°11;800131053;Córdoba;Montería;;
SENA REGIONAL VALLE Grupo de Apoyo Administrativo Mixto;899999034;Valle del Cauca;Cali;;
MUNICIPIO DE SAN AGUSTIN;891180056;Huila;San Agustín;;
ALCALDIA MUNICIPAL DE NOBSA;891855222;Boyacá;Nobsa;;
I.E.D. DIVINO SALVADOR;860506975;Cundinamarca;Cucunubá;;
DEPARTAMENTO ADMINISTRATIVO DE LA PRESIDENCIA DE LA REPUBLICA;899999083;No Definido;No Definido;;
SENA REGIONAL BOLIVAR Centro para la Industria Petroquímica;899999034;Bolívar;Cartagena;;
UNIDAD DE SERVICIOS PENITENCIARIOS Y CARCELARIOS - USPEC;900523392;Distrito Capital de Bogotá;Bogotá;;
ESTABLECIMIENTO PENITENCIARIO DE MEDIANA SEGURIDAD Y CARCELARIO DE NEIVA;813001835;Huila;Rivera;;
HOSPITAL SAN JUAN DE DIOS DE HONDA ESE;890700666;Tolima;Ibagué;;
DIRECCION DE SANIDAD DE EJERCITO-DISPENSARIO MEDICO FLORENCIA;901440188;Caquetá;Florencia;;
SUPERINTENDENCIA DE VIGILANCIA Y SEGURIDAD PRIVADA;800217123;Distrito Capital de Bogotá;Bogotá;;
MUNICIPIO DE ITAGUI;890980093;No Definido;No Definido;;
ALCALDÍA DE PORE;800099429;No Definido;No Definido;;
SENA REGIONAL TOLIMA 1;899999034;Tolima;Ibagué;;
PERSONERIA MUNICIPAL DE SAN  FRANCISCO CUNDINAMARCA;899999173;Cundinamarca;San Francisco;;
MUNICIPIO DE PALERMO HUILA;891180021;No Definido;No Definido;;
FONDO ROTATORIO DE LA POLICIA;860020227;Distrito Capital de Bogotá;No Definido;;
EMPRESA DE SERVICIOS PUBLICOS DE SAN FRANCISCO SAS E.S.P;900358638;Cundinamarca;San Francisco;;
ALCALDIA MUNICIPAL DE BAHIA SOLANO CHOCO;891680395;No Definido;No Definido;;
ALCALDIA DISTRITAL DE BUENAVENTURA-VALLE;890399045;No Definido;No Definido;;
ESTABLECIMIENTO DE SANIDAD MILITAR 1034 BARRANQUILLA;830039670;Arauca;Arauca;;
MUNICIPIO DE LA PAZ;800096605;No Definido;No Definido;;
ALCALDÍA MUNICIPAL DE MAGANGUE;800028432;No Definido;No Definido;;
MUNICIPIO DE VILLA DE LEYVA;891801268;Boyacá;No Definido;;
SENA SECRETARIA GENERAL;899999034;Distrito Capital de Bogotá;No Definido;;
UNIDAD PRESTADORA DE SALUD NARIÑO;900807338;Nariño;Pasto;;
PERSONERIA MUNICIPAL DE NEIVA;8002512646;Huila;Neiva;;
ESTABLECIMIENTO PENITENCIARIO Y CARCELARIO DE SOGAMOSO;826000801;Boyacá;No Definido;;
IDIGER;800154275;No Definido;No Definido;;
ESE HOSPITAL DE JUAN DE ACOSTA;802003414;Atlántico;Juan De Acosta;;
MINISTERIO DE TRABAJO DIRECCION TERRITORIAL CAQUETA;830115226;Caquetá;Florencia;;
DIRECCIÓN DE SANIDAD NAVAL;830039670;Distrito Capital de Bogotá;Bogotá;;
DGSM-DISAN-ARC-ESM 3030 HOSPITAL NAVAL DE BAHIA MALAGA;830039670;Valle del Cauca;No Definido;;
CONTRALORIA DE CUNDINAMARCA;899999117;Distrito Capital de Bogotá;No Definido;;
MUNICIPIO DE SABANALARGA;890983736;No Definido;No Definido;;
INSTITUTO COLOMBIANO AGROPECUARIO - SECCIONAL VICHADA;899999069;Vichada;Puerto Carreño;;
MUNICIPIO DE SAN EDUARDO;891801282;Boyacá;Socha;;
MUNICIPIO DE SACAMA;800103663;No Definido;No Definido;;
ESTABLECIMIENTO PENITENCIARIO DE MEDIANA SEGURIDAD Y CARCELARIO DE CAQUEZA;832001806;Cundinamarca;Caqueza;;
MUNICIPIO LA ARGENTINA;891180205;Huila;La Argentina;;
SERVICIO NACIONAL DE APRENDIZAJE SENA - REGIONAL VAUPES;899999034;Vaupés;Mitú;;
UNIDAD NACIONAL DE PROTECCIÓN;900475780;No Definido;No Definido;;
CORPORACIÓN AUTÓNOMA REGIONAL DEL CENTRO DE ANTIOQUIA;811000231;Antioquia;Medellín;;
ALCALDIA MUNICIPAL DE TENA;800004574;Cundinamarca;Tena;;
DIRECCION DE  SANIDAD EJERCITO DISPENSARIO MEDICO IBAGUE;830039670;Tolima;Ibagué;;
INSTITUTO DISTRITAL DE RECREACIÓN Y DEPORTE;860061099;Distrito Capital de Bogotá;No Definido;;
MUNICIPIO DE LA PLATA;891180155;Huila;La Plata;;
UNIDAD DE INFORMACION Y ANALISIS FINANCIERO;830068074;Distrito Capital de Bogotá;Bogotá;;
FONDANE - DIR TER NOROCCIDENTE;800072977;Antioquia;Medellín;;
CORPORACIÓN SOCIAL DE CUNDINAMARCA;899999421;Distrito Capital de Bogotá;Bogotá;;
MINISTERIO DE JUSTICIA Y DEL DERECHO;900457461;No Definido;No Definido;;
UAE FONDO NACIONAL DE ESTUPEFACIENTES;899999327;No Definido;No Definido;;
instituto de transito y Transporte de Cienaga Magdalena;819004646;Magdalena;Ciénaga;;
CONTRALORIA GENERAL DEL DEPARTAMENTO DEL PUTUMAYO;800193022;Putumayo;Mocoa;;
Rama Judicial  Dirección Seccional de Administración Judicial de Cúcuta;800165874;Norte de Santander;Cúcuta;;
SENA REGIONAL CALDAS CENTRO DE COMERCIO Y SERVICIOS;899999034;Caldas;Manizales;;
UNIVERSIDAD NACIONAL DE COLOMBIA;899999063;Distrito Capital de Bogotá;Bogotá;;
METRO CALI S.A;805013171;No Definido;No Definido;;
ARMADA NACIONAL BATALLON DE COMANDO Y APOYO DE INFANTERIA DE MARINA No 4;800141667;Nariño;Tumaco;;
ALCALDIA MUNICIPAL DE RICAURTE;800099127;Nariño;Ricaurte;;
INSTITUCION EDUCATIVA TECNICA ENRIQUE OLAYA HERRERA;800191549;Boyacá;Guateque;;
UNIDAD ADMINISTRATIVA ESPECIAL PARA LA GESTION DEL RIESGO DE DESASTRES DE CUNDINAMARCA;899999114;Distrito Capital de Bogotá;No Definido;;
INSTITUTO MUNICIPAL DE DEPORTES; RECREACION Y CULTURA;802014605;Atlántico;Ponedera;
I.D.E.R.F.;890680338;Cundinamarca;Fusagasugá;;
ESTABLECIMIENTO PENITENCIARIO DE MEDIANA SEGURIDAD Y CARCELARIO DE SEVILLA - INPEC;821000631;Valle del Cauca;Sevilla;;
UNIDAD PRESTADORA DE SALUD HUILA;901362454;Huila;Neiva;;
ALCALDIA MUNICIPIO DE GARZON;891180022;No Definido;No Definido;;
UNIDAD ADMINISTRATIVA ESPECIAL UNIDAD DE PROYECCION NORMATIVA Y ESTUDIOS DE REGULACION FINANCIERA;900657800;Distrito Capital de Bogotá;Bogotá;;
ALCALDIA DE CIUDAD BOLIVAR;890980330;No Definido;No Definido;;
MUNICIPIO DE SAN MATEO;891857821;No Definido;No Definido;;
PERSONERÍA MUNICIPAL DE COGUA;899999466;Cundinamarca;Cogua;;
AGENCIA NACIONAL DE TIERRAS;900948953;No Definido;No Definido;;
DEPARTAMENTO DE CUNDINAMARCA - SECRETARÍA DE ASUNTOS INTERNACIONALES;899999114;No Definido;No Definido;;
FONDO NACIONAL DE VIVIENDA;830121208;Distrito Capital de Bogotá;Bogotá;;
PARQUES NACIONALES NATURALES DE COLOMBIA-SUBCUENTA FONDO NACIONAL AMBIENTAL;901037393;No Definido;No Definido;;
ALCALDÍA MUNICIPAL  DE SOACHA;800094755;Cundinamarca;Soacha;;
SENA REGIONAL CASANARE Grupo Administrativo Mixto;899999034;Casanare;Yopal;;
POLICIA METROPOLITANA DE CARTAGENA DE INDIAS;900149064;Bolívar;Cartagena;;
FONDO DE VIVIENDA DE INTERES SOCIAL Y REFORMA URBANA DISTRITAL DE CARTAGENA DE INDIAS;800165392;Bolívar;Cartagena;;
POLICÍA METROPOLITANA DE MANIZALES;900805219;Caldas;Manizales;;
CONTRALORÍA MUNICIPAL DE PASTO;800156682;Nariño;Pasto;;
MUNICIPIO DE SANTA ROSA DEL SUR;800049017;Bolívar;Santa Rosa Del Sur;;
ESTABLECIMIENTO PENITENCIARIO DE MEDIANA SEGURIDAD Y CARCELARIO DE CAUCASIA;811010133;Antioquia;Caucasia;;
ALCALDIA LOCAL DE PUENTE ARANDA-FONDO DE DESARROLLO LOCAL;899999061;Distrito Capital de Bogotá;Bogotá;;
ESE HOSPITAL ANDRES GIRARDOT;891855439;Boyacá;No Definido;;
GOBERNACION DEL VALLE - SECRETARIA DE ASUNTOS ETNICOS;890399029;Valle del Cauca;Cali;;
E.S.E HOSPITAL LOCAL DE CANDELARIA VALLE;891380184;No Definido;No Definido;;
AGENCIA NACIONAL DE INFRAESTRUCTURA - ANI;8301259969;Distrito Capital de Bogotá;Bogotá;;
MUNICIPIO DE FLORESTA;800026368;Boyacá;No Definido;;
CENTRAL ADMINISTRATIVA ESPECIALIZADA INGENIEROS;830087443;No Definido;No Definido;;
GOBERNACION DEL GUAVIARE;800103196;No Definido;No Definido;;
MUNICIPIO DE SANTANA;800020733;Atlántico;Barranquilla;;
MINISTERIO DEL TRABAJO DIRECCION TERRITORIAL DEL AMAZONAS;838000330;Amazonas;No Definido;;
DEPARTAMENTO DE POLICIA GUAJIRA;800140974;La Guajira;Riohacha;;
ALCALDIA DE NEIRA;890801135;No Definido;No Definido;;
FONDO DE VIVIENDA DE INTERÉS SOCIAL DEL DEPARTAMENTO DEL HUILA;900094866;Huila;Neiva;;
DIRECCIÓN DE SANIDAD EJÉRCITO;830039670;Distrito Capital de Bogotá;No Definido;;
INSTITUTO GEOGRÁFICO AGUSTÍN CODAZZI;899999004;No Definido;No Definido;;
GOBERNACIÓN DE BOLÍVAR;890480059;Bolívar;Turbaco;;
DISAN AREA DE SANIDAD SAN ANDRES;800141053;San Andrés, Providencia y Santa Catalina;No Definido;;
UNIDAD PRESTADORA DE SALUD META POLICÍA NACIONAL;901361398;Meta;Villavicencio;;
INSTITUTO PARA LA INVESTIGACIÓN Y LA PRESERVACIÓN DEL PATRIMONIO CULTURAL  Y NATURAL DEL VALLE DEL CAUCA;800086201;No Definido;No Definido;;
ALCALDIA MUNICIPIO DE CUITIVA;8918557697;No Definido;No Definido;;
ESTABLECIMIENTO PENITENCIARIO DE MEDIANA SEGURIDAD Y CARCELARIO OCAÑA;807001559;Norte de Santander;Ocaña;;
ESTABLECIMIENTO PENITENCIARIO Y CARCELARIO DE PASTO;814001035;Nariño;No Definido;;
DIRECCION DE ANTINARCOTICOS;800141379;Distrito Capital de Bogotá;Bogotá;;
RESGUARDO INDIGENA KANKUAMO;900874999;No Definido;No Definido;;
ESTABLECIMIENTO PENITENCIARIO Y CARCELARIO SANTANDER DE QUILICHAO;800143359;Cauca;Santander De Quilichao;;
ESTABLECIMIENTO PENITENCIARIO DE MEDIANA SEGURIDAD Y CARCELARIO DE ARAUCA - INPEC;834000421;Arauca;Arauca;;
MUNICIPIO DE ACEVEDO;891180069;No Definido;No Definido;;
MUNICIPIO DE SANTA FE DE ANTIOQUIA;890907569;No Definido;No Definido;;
EMPRESA DE SERVICIOS PUBLICOS DOMICILIARIOS DE VALPARAISO S.A.S ESP;900477448;No Definido;No Definido;;
CONTRALORIA DEPARTAMENTAL DEL CAQUETA;891190246;Caquetá;Florencia;;
ALCALDIA MUNICIPIO PAIME;899999704;Distrito Capital de Bogotá;No Definido;;
MUNICIPIO DE SANTIAGO DE CALI - SECRETARIA DE DESARROLLO ECONOMICO;890399011;Valle del Cauca;Cali;;
GOBERNACION DEL VALLE DEL CAUCA - SECRETARIA DE DESARROLLO SOCIAL Y PARTICIPACION;8903990291;Valle del Cauca;Cali;;
MUNICIPIO DE SANTIAGO DE CALI - SECRETARÍA DE GESTIÓN DEL RIESGO DE EMERGENCIAS Y DESASTRE;890399011;Valle del Cauca;Cali;;
CONCEJO MUNICIPAL DE SUAREZ TOLIMA;809005520;No Definido;No Definido;;
SENA REGIONAL CUNDINAMARCA Grupo Administrativo CBA;899999034;Cundinamarca;Mosquera;;
ESTABLECIMIENTO PENITENCIARIO DE MEDIANA SEGURIDAD Y CARCELARIO DE RIOSUCIO CALDAS;810001055;Caldas;Riosucio;;
CENTRAL ADMINISTRATIVA  Y CONTABLE - CENAC- POPAYAN;900156335;Cauca;Popayán;;
Rama Judicial  Dirección Seccional de Administración Judicial de Medellín;800165798;Antioquia;Medellín;;
INSTITUCION EDUCATIVA ESCUELA NORMAL SUPERIOR REBECA SIERRA CARDONA;890803662;No Definido;No Definido;;
GESTORA URBANA BANCO INMOBILIARIO DE IBAGUE;809009742;No Definido;No Definido;;
ESTABLECIMIENTO PENITENCIARIO DE MEDIANA SEGURIDAD Y CARCELARIO DE FLORENCIA - INPEC;828000309;Caquetá;Florencia;;
SENA REGIONAL NARIÑO Grupo Administrativo CAPCP;899999034;Nariño;Tumaco;;
BATALLON DE ABASTECIMIENTOS Nº 1;800245010;Distrito Capital de Bogotá;Bogotá;;
ALCALDIA MUNICIPAL DE SANTA BARBARA;8909803441;No Definido;No Definido;;
CORPORACION AUTONOMA REGIONAL DE SANTANDER CAS;804000292;Santander;San Gil;;
ALCALDÍA MUNICIPIO DE PALMIRA;891380007;Valle del Cauca;Palmira;;
GOBERNACION DEL MAGDALENA;800103920;Magdalena;Santa Marta;;
MUNICIPIO DE CORINTO;891501283;Cauca;Corinto;;
ESTABLECIMIENTO PENITENCIARIO DE MEDIANA SEGURIDAD Y CARCELARIO DE ISTMINA;900168448;Chocó;Istmina;;
INSTITUCION EDUCATIVA DEPARTAMETAL GENERAL SANTANDER;899999724;Cundinamarca;Sibaté;;
PARQUES NACIONALES NATURALES DE COLOMBIA;830016624;Distrito Capital de Bogotá;No Definido;;
CONTRALORIA GENERAL DE ANTIOQUIA;811000372;No Definido;No Definido;;
ALCALDÍA MUNICIPAL DE BELMIRA ANTIOQUIA;890981880;No Definido;No Definido;;
MUNICIPIO DE CERINZA;891857805;Boyacá;Cerinza;;
MINISTERIO DE TRABAJO VICHADA;842000181;Vichada;Puerto Carreño;;
CONTRALORIA GENERAL DE LA REPUBLICA -CGR- GERENCIA DEPARTAMENTAL QUINDIO;899999067;Quindío;Armenia;;
CENTRAL ADMINISTRATIVA Y CONTABLE - CENAC -TUNJA;800130646;Boyacá;Tunja;;
BATALLON DE COMANDO Y APOYO DE INFANTERIA DE MARINA NO 1;823001882;Sucre;Corozal;;
MUNICIPIO DE FREDONIA;890980848;No Definido;No Definido;;
ALCALDIA MUNICIPAL DE BARBOSA SANTANDER;890206033;No Definido;No Definido;;
ALCALDIA SAN PABLO DE BORBUR;891801369;Boyacá;San Pablo De Borbur;;
ALCALDIA MUNICIPAL DE SABANALARGA;800094844;No Definido;No Definido;;
PATRIMONIO AUTÓNOMO FONDO NACIONAL DEL TURISMO FONTUR;900649119;Distrito Capital de Bogotá;Bogotá;;
CORPORACIÓN AUTONOMA REGIONAL DEL VALLE DEL CAUCA;890399002;Valle del Cauca;Cali;;
EMPRESA DE TRANSPORTE DEL TERCER MILENIO TRANSMILENIO S. A.;830063506;Distrito Capital de Bogotá;Bogotá;;
SECRETARIA DE AMBIENTE Y DESARROLLO SOSTENIBLE;8903990295;Valle del Cauca;Cali;;
GOBERNACION DEL HUILA;800103913;Huila;Neiva;;
ALCALDÍA MUNICIPAL DE SAMANÁ;890801149;Caldas;Samaná;;
SENA REGIONAL HUILA Grupo Administrativo Mixto Neiva;899999034;Huila;Neiva;;
ARMADA NACIONAL JEFATURA DE DESARROLO HUMANO Y FAMILIA;800141644;Distrito Capital de Bogotá;Bogotá;;
AGENCIA DE DESARROLLO RURAL;900948958;No Definido;No Definido;;
UNIDAD ADMINISTRATIVA ESPECIAL JUNTA CENTRAL DE CONTADORES;900180739;Distrito Capital de Bogotá;No Definido;;
ALCALDIA MUNICIPIO DE SANTANDER DE QUILICHAO;891500269;No Definido;No Definido;;
ALCALDÍA MUNICIPAL DE PATÍA;891502194;Cauca;Patía;;
MUNICIPIO DE TANGUA;800099151;Nariño;Tangua;;
MUNICIPIO DE LA UVITA;891856257;No Definido;No Definido;;
SOCIEDAD FIDUCIARIA DE DESARROLLO AGROPECUARIO S.A.;8001599980;Distrito Capital de Bogotá;Bogotá;;
ALCALDIA DE GAMA;800094684;No Definido;No Definido;;
COLEGIO DISTRITAL REPUBLICA DE COLOMBIA;860532330;Distrito Capital de Bogotá;Bogotá;;
INSTITUCION EDUCATIVA HERNANDO VELEZ MARULANDA;891411960;Risaralda;Pereira;;
ESCUELA MILITAR DE AVIACION;800141621;Distrito Capital de Bogotá;Bogotá;;
