Entidad;Nit Entidad;Departamento Entidad;Ciudad Entidad;;
INSTITUCION EDUCATIVA MUNICIPAL MANUELA AYALA DE GAITAN;8999991323;Cundinamarca;Facatativá;;
BATALLON DE APOYO Y SERVICIO PARA EL COMBATE N°15;818000606;Chocó;Quibdó;;
ESE HOSPITAL SAN BERNARDO;890802223;Caldas;Manizales;;
MUNICIPIOS ASOCIADOS DEL VALLE;900991825;No Definido;No Definido;;
RECLUSION DE MUJERES DE POPAYAN - INPEC;817001267;Cauca;Popayán;;
BATALLON DE APOYO Y SERVICIOS PARA EL COMBATE Nº 19;800131272;Distrito Capital de Bogotá;Bogotá;;
EMPRESA DE DESARROLLO URBANO Y VIVIENDA DE INTERES SOCIAL DE BARRANCABERMEJA;890270833;Santander;Barrancabermeja;;
ESTABLECIMIENTO PENITENCIARIO LAS HELICONIAS;900416823;Caquetá;Florencia;;
EMPRESAS PUBLICAS MUNICIPALES DE BELÉN DE UMBRÍA SAS ESP;8160033791;Risaralda;Belén De Umbría;;
ICBF REGIONAL SUCRE;899999239;Sucre;Sincelejo;;
ALCALDIA MUNICIPAL DE SABOYA;800028517;Boyacá;Saboyá;;
ALCALDIA DEL MUNICIPIO DE DIBULLA;825000134;No Definido;No Definido;;
ALCALDIA MUNICIPAL DE UBALA;899999385;Cundinamarca;Junín;;
EMPRESA SOCIAL DEL ESTADO CENTRO DE SALUD TAUSA;832008321;No Definido;No Definido;;
INSTITUTO DISTRITAL DE PROTECCION Y BIENESTAR ANIMAL;901097324;Distrito Capital de Bogotá;No Definido;;
MINISTERIO DEL TRABAJO DIRECCION TERRITORIAL DE RISARALDA;816007249;No Definido;No Definido;;
INSTITUTO COLOMBIANO AGROPECUARIO - SECCIONAL CORDOBA;899999069;Córdoba;Montería;;
CONTRALORIA MUNICIPAL DE BARRANCABERMEJA;8290007456;Santander;Barrancabermeja;;
MUNICIPIO DE ROSAS;8000959834;Cauca;Rosas;;
INSTITUCION EDUCATIVA NACIONALIZADA TECNICA AGROPECUARIA CAMPOHERMOSO;800249216;No Definido;No Definido;;
EMPRESA SOCIAL DEL ESTADO HOSPITAL MARÍA AUXILIADORA;891103968;Huila;Neiva;;
INSTITUTO DEPARTAMENTAL DE DEPORTES DE ANTIOQUIA;811007127;Antioquia;Medellín;;
ESTABLECIMIENTO CARCELARIO DE ZIPAQUIRA;832001785;Cundinamarca;Zipaquirá;;
MUNICIPIO DE EL PLAYON;890208199;Santander;El Playón;;
DEPARTAMENTO ADMINISTRATIVO DEL SERVICIO CIVIL DISTRITAL;8999990619;Distrito Capital de Bogotá;No Definido;;
SUPERINTENDENCIA DEL SUBSIDIO FAMILIAR;860503600;Distrito Capital de Bogotá;Bogotá;;
CONTRALORÍA GENERAL DE LA REPÚBLICA- CGR-GERENCIA DEPARTAMENTAL TOLIMA;899999067;Tolima;Ibagué;;
DEPARTAMENTO DE POLICIA QUINDIO;800140986;Quindío;Armenia;;
MUNICIPIO EL COCUY;891857844;Boyacá;El Cocuy;;
MINISTERIO DEL TRABAJO DIRECCION TERRITORIAL BOLIVAR;806011177;Bolívar;Cartagena;;
INSTITUCION EDUCATIVA DEPARTAMENTAL JOSE HUGO ENCISO;8000095907;Cundinamarca;Anolaima;;
PERSONERIA MUNICIPAL DE RESTREPO - VALLE DEL CAUCA;891902191;Valle del Cauca;Restrepo;;
SENA REGIONAL NARIÑO CENTRO SUR COLOMBIANO DE LOGISTICA INTERNACIONAL;899999034;Nariño;Ipiales;;
INSTITUCION EDUCATIVA RURAL SANPEREGRINO MANIZALES;890807930;Caldas;Manizales;;
INSTITUTO DEPARTAMENTAL DE DEPORTE Y RECREACIÓN DE BOLIVAR;806005353;Distrito Capital de Bogotá;Bogotá;;
DIRECCION GENERAL MARITIMA - INRED 4;806006269;Bolívar;Cartagena;;
SENA-REGIONAL ATLANTICO -CENTRO PARA EL DESARROLLO AGROECOLOGICO Y AGROINDUSTRIAL;899999034;Atlántico;Sabanalarga;;
EMPRESA DE ACUEDUCTO Y ALCANTARILLADO DE BOGOTÁ - E.S.P.;899999094;No Definido;No Definido;;
ICBF REGIONAL GUAJIRA;899999239;La Guajira;Riohacha;;
INSTITUCION EDUCATIVA AURELIANO FLOREZ CARDONA;890804669;No Definido;No Definido;;
CORPORACIÓN AUTONOMA REGIONAL DEL TOLIMA;890704536;No Definido;No Definido;;
ESTABLECIMIENTO PENITENCIARIO DE MEDIANA SEGURIDAD Y CARCELARIO DE HONDA;809003291;Tolima;Honda;;
CENTRO CULTURAL BACATA;832006487;Cundinamarca;Funza;;
CONTRALORIA GENERAL DE LA REPUBLICA-CGR- GERENCIA DEPARTAMENTAL ATLÁNTICO;899999067;Atlántico;Barranquilla;;
ALCALDIA MUNICIPIO DE CIRCASIA QUINDIO;890001044;Quindío;Circasia;;
INSTITUTO DEPARTAMENTAL DE DEPORTES DEL MAGDALENA;8190008433;No Definido;No Definido;;
CENTRO DE MEDICINA NAVAL;9014332637;Distrito Capital de Bogotá;Bogotá;;
UNIDAD PRESTADORA DE SALUD SANTANDER;901361090;Santander;Bucaramanga;;
ALCALDIA MUNICIPAL DE TINJACA;800028436;Boyacá;Tinjacá;;
CONTRALORIA GENERAL DE LA REPUBLICA-CGR- GERENCIA DEPARTAMENTAL ANTIOQUIA;899999067;Antioquia;Medellín;;
MUNICIPIO DE SANTIAGO DE CALI - SECRETARIA DE TURISMO;890399011;Valle del Cauca;Cali;;
INSTITUCION EDUCATIVA DISTRITAL COMUNITARIA OCTAVIO PAZ;802007707;Atlántico;Barranquilla;;
MINISTERIO DE CULTURA;830034348;No Definido;No Definido;;
ALCALDIA DE MALAMBO;8901143351;No Definido;No Definido;;
ALCALDÍA  MUNICIPIO DE SIACHOQUE;891801911;No Definido;No Definido;;
MINISTERIO DEL TRABAJO DIRECCION TERRITORIAL DEL TOLIMA;809010738;Tolima;Ibagué;;
ASAMBLEA DEPARTAMENTAL DE ANTIOQUIA;890900286;Antioquia;Medellín;;
MUNICIPIO DE BERBEO;800099390;Boyacá;Berbeo;;
POLICIA METROPOLITANA DE POPAYAN;900593683;Cauca;Popayán;;
MUNICIPIO DE PENSILVANIA;890801137;No Definido;No Definido;;
DIRECCION EJECUTIVA DE LA JUSTICIA PENAL MILITAR;900384997;Arauca;Arauca;;
EMPRESA SOCIAL DEL ESTADO HOSPITAL REGIONAL DE DUITAMA;891855438;No Definido;No Definido;;
SENA - CENTRO LATINOAMERICANO DE ESPECIES MENORES TULUA;899999034;Valle del Cauca;Tuluá;;
MUNICIPIO DE TARAZA;890984295;No Definido;No Definido;;
ESTABLECIMIENTO PENITENCIARIO DE MEDIANA SEGURIDAD Y CARCELARIO SOCORRO;804004058;Distrito Capital de Bogotá;Bogotá;;
ESTABLECIMIENTO PENITENCIARIO DE MEDIANA SEGURIDAD Y CARCELARIO DE PUERTO BERRIO;811010107;Antioquia;Puerto Berrío;;
ALCALDIA MUNICIPIO DE ARGELIA;891500725;No Definido;No Definido;;
MUNICIPIO DE SANTIAGO DE CALI - SECRETARIA DE DESARROLLO TERRITORIAL Y PARTICIPACION CIUDADANA;890399011;Valle del Cauca;Cali;;
ESAP SEDE CENTRAL (Cuenta Oficial);899999054;No Definido;No Definido;;
FONDO DE GARANTÍAS DE ENTIDADES COOPERATIVAS - FOGACOOP;830053319;Distrito Capital de Bogotá;No Definido;;
MUNICIPIO DE BELEN;800099199;No Definido;No Definido;;
INSTITUCIÓN EDUCATIVA DEPARTAMENTAL AGROPECUARIO LA SIERRA;800012035;No Definido;No Definido;;
MUNICIPIO ALCALDIA DE ONZAGA;890208148;Distrito Capital de Bogotá;Bogotá;;
EMPRESA DE SERVICIOS PÚBLICOS LA UNIÓN S.A E.S.P;811014879;Antioquia;La Unión;;
ALCALDIA ZIPACON;800094778;No Definido;No Definido;;
METROPARQUES;890984630;No Definido;No Definido;;
GUAVIARE SANIDAD;8002527222;Guaviare;San José Del Guaviare;;
SUPERINTENDENCIA FINANCIERA DE COLOMBIA;890999057;Distrito Capital de Bogotá;Bogotá;;
SENA REGIONAL CUNDINAMARCA Grupo Administrativo CTDPE;899999034;Cundinamarca;Girardot;;
AGENCIA NACIONAL DE MINERIA;900500018;Distrito Capital de Bogotá;Bogotá;;
CENTRAL ADMINISTRATIVA Y CONTABLE - CENAC- FLORENCIA;808001433;Caquetá;Florencia;;
ICBF REGIONAL CESAR;899999239;No Definido;No Definido;;
MUNICIPIO DE QUIPAMA;800029513;No Definido;No Definido;;
SECRETARÍA DE LA FUNCIÓN PÚBLICA - DEPARTAMENTO DE CUNDINAMARCA;899999114;Distrito Capital de Bogotá;Bogotá;;
MUNICIPIO SAN VICENTE DEL CAGUAN;800095785;No Definido;No Definido;;
SENA REGIONAL SANTANDER Grupo de Apoyo Administrativo Mixto;899999034;Arauca;Arauca;;
DEPARTAMENTO DE POLICIA PUTUMAYO;800141203;Putumayo;Mocoa;;
ESTABLECIMIENTO PENITENCIARIO DE MEDIANA SEGURIDAD Y CARCELARIO DE PAZ DE ARIPORO;844000697;Distrito Capital de Bogotá;Bogotá;;
MINISTERIO DEL TRABAJO TERRITORIAL MAGDALENA;800226041;Magdalena;No Definido;;
MUNICIPIO DE MONGUI;891856555;No Definido;No Definido;;
MINISTERIO DE DEFENSA- EJERCITO NACIONAL - CENTRAL ADMINISTRATIVA Y CONTABLE BUENAVISTA;800130681;La Guajira;Riohacha;;
DISPENSARIO MEDICO DE MEDELLÍN;8300396705;Antioquia;Medellín;;
MUNICIPIO DE SANTIAGO DE CALI - SECRETARIA DE SEGURIDAD Y JUSTICIA;890399011;Valle del Cauca;Cali;;
ESCUELA SUPERIOR DE GUERRA;830002634;No Definido;No Definido;;
MUNICIPIO DE CIENEGA;891801988;No Definido;No Definido;;
ESTABLECIMIENTO PENITENCIARIO MEDIANA SEGURIDAD Y CARCELARIO SONSON;811010113;Distrito Capital de Bogotá;Bogotá;;
EMPRESA DE ACUEDUCTO Y ALCANTARILLADO AGUAS DE PALMIRA S.A. E.S.P.;900596967;Valle del Cauca;Palmira;;
EMPRESA INDUSTRIAL Y COMERCIAL LOTERIA DE CUNDINAMARCA;860037234;No Definido;No Definido;;
UNIVERSIDAD CES;8909840026;Antioquia;Medellín;;
DEPARTAMENTO DE POLICIA VICHADA;842000015;No Definido;No Definido;;
MINISTERIO DE SALUD Y PROTECCIÓN SOCIAL;900474727;Distrito Capital de Bogotá;No Definido;;
MINISTERIO DEL TRABAJO-DIRECCION TERRITORIAL HUILA;800216593;Huila;No Definido;;
ALCALDIA LOCAL DE USAQUEN;899999061;No Definido;No Definido;;
MUNICIPIO DE PRADERA;891380115;No Definido;No Definido;;
CENTRAL ADMINISTRATIVA Y CONTABLE DE  VILLAVICENCIO - CENAC VILLAVICENCIO;800130752;Meta;Villavicencio;;
CONCEJO MUNICIPAL DE MEDELLIN;890905211;Antioquia;Medellín;;
EMPRESA DE RENOVACION Y DESARROLLO URBANO ERUM S.A.S;810000319;Caldas;Manizales;;
MUNICIPIO DE TELLO;891180127;No Definido;No Definido;;
DISPENSARIO MEDICO TOLEMAIDA;830039670;Cundinamarca;Nilo;;
INSTITUTO NACIONAL PENITENCIARIO Y CARCELARIO REGIONAL NOROESTE;811011575;Antioquia;Medellín;;
INSTITUCION EDUCATIVA RURAL DEPARTAMENTAL INSTITUTO DE PROMOCION SOCIAL;832001324;No Definido;No Definido;;
ASOCIACIÓN CANAL LOCAL DE TELEVISIÓN DE MEDELLIN - TELEMEDELLIN;811006762;Antioquia;Medellín;;
POLICIA METROPOLITANA DE VILLAVICENCIO;900486513;No Definido;No Definido;;
ASAMBLEA DEPARTAMENTAL DEL TOLIMA;809000799;Tolima;Ibagué;;
MUNICIPIO DE RAMIRIQUI;891801280;Boyacá;Ramiriquí;;
RADIO TELEVISION NACIONAL DE COLOMBIA.;900002583;No Definido;No Definido;;
MUNICIPIO DE PLANETA RICA CORDOBA;800096765;No Definido;No Definido;;
PERSONERIA MUNICIPAL DE TENJO;800095174;Cundinamarca;Tenjo;;
AREA METROPOLITANA CENTRO OCCIDENTE;891410902;Risaralda;Pereira;;
Alcaldia Municipal de Sutamarchan;800030988;Boyacá;Sutamarchán;;
CARCEL Y PENITENCIARIA DE MEDIA SEGURIDAD DE PUERTO TRIUNFO;900356765;Antioquia;Puerto Triunfo;;
MUNICIPIO DE MEDELLIN;890905211;Antioquia;Medellín;;
PERSONERÍA MUNICIPAL DE EBÉJICO;890983664;Antioquia;Ebéjico;;
BASE NAVAL ARC BOLIVAR;800141645;Bolívar;Cartagena;;
GRUPO AÉREO DEL CARIBE;800141634;San Andrés, Providencia y Santa Catalina;San Andrés;;
ESE CENTRO DE SALUD SAN JOSE DE NIMAIMA;832009187;No Definido;No Definido;;
DEPARTAMENTO DE POLICIA URABA;800141103;Antioquia;Apartadó;;
INSTITUCION EDUCATIVA HERNANDO GELVEZ SUAREZ;820002364;No Definido;No Definido;;
ALCALDIA MUNICIPIO DE CAJICA;899999465;Distrito Capital de Bogotá;No Definido;;
MUNICIPIO DE PUERTO NARE;8909810008;No Definido;No Definido;;
ESAP TERRITORIAL CAUCA;800117528;Cauca;Popayán;;
COMISION COLOMBIANA DEL OCEANO;800163158;No Definido;No Definido;;
DEPARTAMENTO DEL VALLE DEL CAUCA - OFICINA PARA LA TRANSPARENCIA DE LA GESTIÓN PÚBLICA;890399029;Valle del Cauca;Cali;;
ESTABLECIMIENTO PENITENCIARIO DE MEDIANA SEGURIDAD DE RAMIRIQUI - INPEC;820000975;Distrito Capital de Bogotá;Bogotá;;
ICBF REGIONAL VICHADA;899999239;Vichada;Puerto Carreño;;
SENA REGIONAL AMAZONAS Grupo de Apoyo Administrativo Mixto;899999034;Amazonas;Leticia;;
MUNICIPIO DEL CARMEN;800099238;Norte de Santander;El Carmen;;
INSTITUTO COLOMBIANO AGROPECUARIO - SECCIONAL GUAINIA;899999069;Guainía;Inírida;;
ALCALDIA DISTRITO DE RIOHACHA;892115007;No Definido;No Definido;;
MINISTERIO DEL TRABAJO DIRECCION TERRITORIAL DE CORDOBA;800216323;Córdoba;Montería;;
HOSPITAL SANTA BARBARA EMPRESA SOCIAL DEL ESTADO;890701010;Tolima;Venadillo;;
DANE -DIRECCIÓN TERRITORIAL CENTRO;899999027;Distrito Capital de Bogotá;Bogotá;;
ICBF REGIONAL CASANARE;899999239;Casanare;No Definido;;
GOBERNACION DEL CHOCÓ;891680010;Chocó;Quibdó;;
INSTITUCION EDUCATIVA RURAL DEPARTAMENTAL RINCON GRANDE;832006683;Cundinamarca;Caqueza;;
ALCALDÍA MUNICIPAL DE AQUITANIA;800077545;Boyacá;Aquitania;;
MUNICIPIO DE TOPAGA;891856625;No Definido;No Definido;;
SENA REGIONAL DISTRITO CAPITAL Grupo Administrativo Intercentros CGMLTI;899999034;Distrito Capital de Bogotá;Bogotá;;
INSTITUTO DISTRITAL PARA LA PROTECCIÓN DE LA NIÑEZ Y LA JUVENTUD - IDIPRON;899999333;No Definido;No Definido;;
MUNICIPIO DE MARIPI;800024789;Boyacá;Maripí;;
FONDO MUNICIPAL DE VIVIENDA DE INTERÉS SOCIAL Y REFORMA URBANA DE PUERTO TEJADA;817000320;Cauca;Puerto Tejada;;
DEFENSORÍA DEL PUEBLO;800186061;Distrito Capital de Bogotá;Bogotá;;
CONTRALORIA GENERAL DE LA REPUBLICA-CGR-GERENCIA DEPARTAMENTAL SUCRE;899999067;Sucre;Sincelejo;;
SENA REGIONAL SANTANDER Grupo Administrativo CA;899999034;Santander;San Gil;;
INSTITUTO GEOGRÁFICO AGUSTÍN CODAZZI;899999004;Valle del Cauca;Cali;;
DIRECCION TERRITORIAL DE ARAUCA MINISTERIO DE TRABAJO;834001348;Arauca;Arauca;;
ESCUELA DE POSTGRADOS DE POLICÍA MIGUEL ANTONIO LLERAS PIZARRO;800226849;Distrito Capital de Bogotá;No Definido;;
ALCALDÍA MUNICIPAL DE COCORNÁ;890984634;No Definido;No Definido;;
CONTRALORIA DISTRITAL DE CARTAGENA DE INDIAS;800194000;Bolívar;Cartagena;;
ESE HOSPITAL LOCAL SANTA BARBARA DE PINTO;819004347;Magdalena;Santa Bárbara De Pinto;;
AGENCIA DE CUNDINAMARCA PARA LA PAZ Y LA CONVIVENCIA - ACPC;901024331;Distrito Capital de Bogotá;Bogotá;;
NORTE DE SANTANDER - ALCALDÍA MUNICIPIO DE TEORAMA;800017022;No Definido;No Definido;;
INSTITUCION EDUCATIVA MUNICIPAL LICEO INTEGRADO DE ZIPAQUIRA;832004884;Cundinamarca;Zipaquirá;;
SUPERINTENDENCIA NACIONAL DE SALUD;860062187;Distrito Capital de Bogotá;Bogotá;;
MUNICIPIO DE EL BAGRE;890984221;No Definido;No Definido;;
E.S.E HOSPITAL NUESTRA SEÑORA DEL CARMEN DEL COLEGIO;860020094;No Definido;No Definido;;
SENA REGIONAL PUTUMAYO Grupo de Apoyo Administrativo;899999034;Putumayo;Puerto Asís;;
MUNICIPIO DE LEJANIAS;892099242;Meta;Lejanías;;
EMPRESA DE ENERGIA DE ARAUCA  ENELAR E.S.P;892099499;Arauca;No Definido;;
MUNICIPIO DE ZARAGOZA;890981150;No Definido;No Definido;;
ALCALDÍA MUNICIPAL DE EL PASO;800096592;No Definido;No Definido;;
PERSONERIA MUNICIPAL DE INIRIDA;7180873;Guainía;Inírida;;
Contraloría Municipal de Pereira;800182573;No Definido;No Definido;;
MUNICIPIO DE ASTREA;892301541;No Definido;No Definido;;
ESTABLECIMIENTO PENITENCIARIO Y CARCELARIO SANTA ROSA DE OSOS;811010111;Antioquia;Santa Rosa De Osos;;
BATALLON DE A.S.P.C N° 30 GUASIMALES;900063431;Norte de Santander;Cúcuta;;
INSTITUTO COLOMBIANO AGROPECUARIO - SECCIONAL HUILA;8999990697;Huila;Neiva;;
INPEC EPCAMSVAL;824003186;Cesar;Valledupar;;
ALCALDÍA MUNICIPAL DE SOPO;899999468;Cundinamarca;Sopó;;
DIRECCION DE PROTECCION Y SERVICIOS ESPECIALES;9002592122;Distrito Capital de Bogotá;Bogotá;;
RECLUSION MUJERES MANIZALES;810001114;Caldas;Manizales;;
HOSPITAL REGIONAL ALFONSO JARAMILLO SALAZAR E.S.E.;890701718;Tolima;Ibagué;;
SUBCUENTA PARA LA ADMON DE LOS RECURSOS Y MANEJO SPN FONAM - DTOR;901037393;Meta;Villavicencio;;
MUNICIPIO DE ZAPATOCA;890204138;No Definido;No Definido;;
MUNICIPIO DE MURINDO;890984882;Antioquia;Murindó;;
EMPRESA DE PARQUES Y EVENTOS DE ANTIOQUIA - ACTIVA;901437957;Antioquia;Medellín;;
CORPORACION AUTONOMA REGIONAL DEL ALTO MAGDALENA;800255580;Huila;Neiva;;
EMPRESA DE SERVICIOS PUBLICOS DE TARSO S.A. E.S.P.;900270088;Antioquia;Tarso;;
TELEVISION REGIONAL DEL ORIENTE LIMITADA. CANAL TRO;807000294;No Definido;No Definido;;
GOBERNACIÓN DE SANTANDER;890201235;Santander;Bucaramanga;;
CORPORACION AUTONOMA REGIONAL DE BOYACA CORPOBOYACA;800252843;Boyacá;Tunja;;
INSTITUTO DEPARTAMENTAL DE DEPORTES DEL TOLIMA;809005065;No Definido;No Definido;;
BATALLON CORDOVA;800130675;Magdalena;Santa Marta;;
FINANCIERA DE DESARROLLO NACIONAL S.A.;860509022;Distrito Capital de Bogotá;No Definido;;
INSTITUCION EDUCATIVA INSTITUTO QUIMBAYA;890003779;Quindío;Quimbaya;;
SENA REGIONAL GUAJIRA Grupo Mixto de Apoyo Administrativo;899999034;La Guajira;Riohacha;;
ESTABLECIMIENTO PENITENCIARIO DE MEDIANA SEGURIDAD Y CARCELARIO DE MONTERIA;812001571;No Definido;No Definido;;
INSTITUCION EDUCATIVA DEPARTAMENTAL SAN MIGUEL SIBATE;832009955;Cundinamarca;Sibaté;;
E.S.E CENTRO DE SALUD DE USIACURI;802009049;Atlántico;Usiacurí;;
GOBERNACIÓN DE BOYACÁ;891800498;No Definido;No Definido;;
MUNICIPIO DE SANTIAGO DE CALI - DEPARTAMENTO ADMINISTRATIVO DE PLANEACIÓN MUNICIPAL;890399011;Valle del Cauca;Cali;;
DANE - TERRITORIAL CENTRO ORIENTE;899999027;Santander;Bucaramanga;;
PERSONERIA MUNICIPAL DE GENOVA;890000864;Quindío;Génova;;
INSTITUTO COLOMBIANO DE BIENESTAR FAMILIAR REGIONAL BOLIVAR;899999239;Bolívar;Cartagena;;
MINISTERIO DEL TRABAJO DIRECCIÓN TERRITORIAL DEL CAUCA;817002458;No Definido;No Definido;;
GOBERNACION DE CUNDINAMARCA SECRETARIA DE GOBIERNO;899999114;Distrito Capital de Bogotá;No Definido;;
SUBRED INTEGRADA DE SERVICIOS DE SALUD NORTE E.S.E.;900971006;No Definido;No Definido;;
FONDO ROTATORIO DEL DANE FONDANE-SUROCCIDENTE;800072977;Valle del Cauca;Cali;;
RECLUSION DE MUJERES DE ARMENIA;801000767;Quindío;Armenia;;
MUNICIPIO DE VICTORIA;890801151;Caldas;Manizales;;
ALCALDIA MUNICIPIO EL ROBLE;823002595;Sucre;El Roble;;
REGISTRADURIA NACIONAL DEL ESTADO CIVIL;899999040;No Definido;No Definido;;
ALCALDÍA MUNICIPAL DE TOTA;800012635;Boyacá;Tota;;
MUNICIPIO DE MANIZALES;890801053;No Definido;No Definido;;
ESTABLECIMIENTO PENITENCIARIO DE MEDIANA SEGURIDAD Y CARCELARIO DE TUQUERRES;814001045;No Definido;No Definido;;
MUSEO CASA DE LA MEMORIA;900857221;Antioquia;Medellín;;
ICBF REGIONAL CORDOBA;899999239;Córdoba;No Definido;;
ESCUELA CONTRA LA DROGADICCION;901341579;Antioquia;Rionegro;;
DISPENSARIO MEDICO NEIVA - DIRECCION DE SANIDAD EJERCITO;830039670;Distrito Capital de Bogotá;No Definido;;
MUNICIPIO DE TAURAMENA;800012873;No Definido;No Definido;;
ALCALDIA MUNICIPAL DE NIMAIMA;800094713;Cundinamarca;Nimaima;;
CONTRALORÍA GENERAL DEL CAUCA;891500403;Cauca;Popayán;;
DIRECCIÓN REGIONAL VIEJO CALDAS N° 6 SEDE PEREIRA;816002178;Risaralda;Pereira;;
MINISTERIO DE HACIENDA Y CREDITO PUBLICO;899999090;No Definido;No Definido;;
INSTITUTO DE ESTUDIOS DEL MINISTERIO PUBLICO;8300157281;No Definido;No Definido;;
PARQUES NACIONALES NATURALES DE COLOMBIA - DIRECCION TERRITORIAL CARIBE;819000759;Chocó;Acandí;;
MUNICIPIO DE ANDES;890980342;No Definido;No Definido;;
POLICIA METROPOLITANA SANTIAGO DE CALI;800140625;Caldas;Manizales;;
ALCALDIA MUNICIPAL DE LERIDA;890702034;No Definido;No Definido;;
MUNICIPIO DE VALDIVIA;890981106;No Definido;No Definido;;
PARQUES NACIONALES NATURALES DE COLOMBIA - DIRECCION TERRITORIAL ANDES NORORIENTALES;804001738;No Definido;No Definido;;
ASOCIACION DE MUNICIPIOS DEL ALTO SINU Y SAN JORGE;900210090;No Definido;No Definido;;
GOBERNACIÓN DEL CAUCA;891580016;No Definido;No Definido;;
CORPORACION AUTONOMA REGIONAL DE LAS CUENCAS DE LOS RIOS NEGRO - NARE;890985138;Antioquia;El Santuario;;
INSTITUTO DE DEPORTE Y RECREACION DEL VICHADA;842000142;Vichada;Puerto Carreño;;
DEPARTAMENTO DE CUNDINAMARCA SECRETARIA DE AGRICULTURA Y DESARROLLO RURAL;899999114;Distrito Capital de Bogotá;Bogotá;;
FONDO DE BIENESTAR SOCIAL DE LA CONTRALORIA DEPARTAMENTAL DEL ATLANTICO;802024910;Atlántico;Barranquilla;;
MINISTERIO DEL TRABAJO - DIRECCIÓN TERRITORIAL ATLÁNTICO;802000713;Atlántico;Barranquilla;;
GRUPO AÉREO DEL ORIENTE;842000080;Vichada;La Primavera;;
DEPARTAMENTO ADMINISTRATIVO NACIONAL DE ESTADÍSTICA - DIR TER NOROCCIDENTE - (DANE NOROCCIDENTE);899999027;Antioquia;Medellín;;
UNIDAD PRESTADORA DE SALUD NORTE DE SANTANDER - POLICÍA METROPOLITANA DE CUCUTA;900259415;Norte de Santander;Cúcuta;;
ALCALDIA MUNICIPIO CARMEN DE CARUPA;899999367;No Definido;No Definido;;
EMPRESA DE SERVICIOS PUBLICOS DE ASEO DEL NOROESTE DE CALDAS S.A.S. E.S.P.;901052588;Caldas;Marmato;;
AGENCIA NACIONAL DE HIDROCARBUROS;830127607;No Definido;No Definido;;
ALCALDIA DE GUAYABETAL;800094701;Distrito Capital de Bogotá;No Definido;;
GOBERNACION DE CUNDINAMARCA - ALTA CONSEJERÍA PARA LA FELICIDAD;899999114;No Definido;No Definido;;
ESTABLECIMIENTO PENITENCIARIO DE MEDIANA SEGURIDAD Y CARCELARIO DE BUGA;891301360;Valle del Cauca;Guadalajara De Buga;;
MUNICIPIO DE SANTIAGO DE CALI - DEPARTAMENTO ADMINISTRATIVO DE CONTRATACION PUBLICA;890399011;Valle del Cauca;Cali;;
POLICÍA NACIONAL - DEPARTAMENTO DE POLICÍA CASANARE;844000016;Casanare;Yopal;;
EMPRESA SOCIAL DEL ESTADO HOSPITAL SAN MARTIN DE PORRES DE CHOCONTA;860024766;Cundinamarca;Chocontá;;
MUNICIPIO DE HATO;890210438;No Definido;No Definido;;
MUNICIPIO DE MIRANDA;891500841;Cauca;Miranda;;
GOBERNACION DE LA GUAJIRA;8921150151;Distrito Capital de Bogotá;Bogotá;;
CONTRALORIA GENERAL DE LA REPÚBLICA - CGR GERENCIA DEPARTAMENTAL META;899999067;Meta;Villavicencio;;
CONCEJO MUNICIPAL DE ACHI BOLÍVAR;900074562;Bolívar;Achí;;
MUNICIPIO DE FRONTINO;890983706;No Definido;No Definido;;
FONDO NACIONAL DE GARANTIAS S.A. - FNG;860402272;No Definido;No Definido;;
INSTITUTO COLOMBIANO AGROPECUARIO (ICA) - SECCIONAL SAN ANDRES;89999969;San Andrés, Providencia y Santa Catalina;San Andrés;;
IMPRENTA NACIONAL DE COLOMBIA;830001113;Distrito Capital de Bogotá;No Definido;;
ENTIDAD SOCIAL DEL ESTADO HOSPITAL LOCAL DE PUERTO COLOMBIA;890103406;No Definido;No Definido;;
SERVICIO AEREO A TERRITORIOS NACIONALES S.A.;8999991434;Distrito Capital de Bogotá;Bogotá;;
ESTABLECIMIENTO PENITENCIARIO Y CARCELARIO DE TULUA;821000732;Valle del Cauca;No Definido;;
ASAMBLEA DEPARTAMENTAL DE CUNDINAMARCA;899999716;Distrito Capital de Bogotá;Bogotá;;
ESCUELA DE POLICIA SIMON BOLIVAR;800141336;Valle del Cauca;Tuluá;;
CONTRALORIA GENERAL DE LA REPUBLICA-CGR-GERENCIA DEPARTAMENTAL SAN ANDRES;899999067;San Andrés, Providencia y Santa Catalina;San Andrés;;
ALCALDIA MUNICIPAL DE TOPAIPI;800072715;No Definido;No Definido;;
CENTRAL ADMINISTRATIVA Y CONTABLE ESPECIALIZADA CENAC AVIACION;830039207;Distrito Capital de Bogotá;No Definido;;
UNIDAD PRESTADORA DE SALUD CÓRDOBA;900800975;Córdoba;Montería;;
DEPARTAMENTO ADMINISTRATIVO NACIONAL DE ESTADÍSTICA - DIR TER NORTE;899999027;Atlántico;No Definido;;
MUNICIPIO DE PEQUE;890982301;No Definido;No Definido;;
EMPRESA DE SERVICIOS PUBLICOS DE HERVEO S.A.E.S.P EMPOHERVEO S.A.E.S.P;900325093;No Definido;No Definido;;
POLICIA METROPOLITANA DE NEIVA;900634185;Huila;Neiva;;
MUNICIPIO DE SAN RAFAEL;890982123;No Definido;No Definido;;
BASE NAVAL ARC SAN ANDRES;800141656;No Definido;No Definido;;
ESTABLECIMIENTO CARCELARIO PURIFICACION;809003243;Tolima;Purificación;;
MINISTERIO DEL TRABAJO DIRECCIÓN TERRITORIAL META;800216935;No Definido;No Definido;;
EMPRESA SOCIAL DEL ESTADO NUESTRA SEÑORA DEL ROSARIO DE PISBA;826002963;Boyacá;Pisba;;
MUNICIPIO DE PAYA;800065411;No Definido;No Definido;;
ALCALDIA MUNICIPIO DE EL CARMEN DE VIBORAL;890982616;No Definido;No Definido;;
EMPRESA SOCIAL DE ESTADO OCCIDENTE;900145588;No Definido;No Definido;;
MUNICIPIO DE ALBANIA;891190431;Caquetá;Albania;;
ESTABLECIMIENTO DE DESARROLLO URBANO Y MEDIO AMBIENTE DE SOLEDAD;900128208;Atlántico;Soledad;;
BASE NAVAL No. 3 ARC LEGUIZAMO;800141686;Putumayo;Leguízamo;;
INSTITUTO MUNICIPAL DE DEPORTE Y RECREACION DEL MUNICIPIO DE UBALA;832002496;Cundinamarca;Ubalá;;
ALCALDIA DE LA LOCALIDAD INDUSTRIAL Y DE LA BAHIA;890480184;Bolívar;Cartagena;;
CONTRALORIA DEPARTAMENTAL DEL VALLE DEL CAUCA;800090735;Valle del Cauca;Cali;;
ICBF REGIONAL GUAVIARE;899999239;Guaviare;No Definido;;
AGENCIA NACIONAL DE CONTRATACIÓN PÚBLICA -COLOMBIA COMPRA EFICIENTE-;900514813;Distrito Capital de Bogotá;Bogotá;;
POLICIA METROPOLITANA DE BUCARAMANGA;900233117;Santander;Bucaramanga;;
MUNICIPIO DE SANTIAGO DE CALI - SECRETARIA DE GOBIERNO;890399011;Valle del Cauca;Cali;;
INSTITUTO FINANCIERO PARA EL DESARROLLO DE SANTANDER 1;890205565;No Definido;No Definido;;
MUNICIPIO DE TORIBIO;891500887;No Definido;No Definido;;
MUNICIPIO DE BETEITIVA BOYACA;800017288;Boyacá;Betéitiva;;
BIBLIOTECA DEPARTAMENTAL JORGE GARCES BORRERO;890399039;Valle del Cauca;Cali;;
GOBERNACION DEL VALLE DEL CAUCA - DADI;890399029;Valle del Cauca;Cali;;
MUNICIPIO DE CAPARRAPI;899999710;No Definido;No Definido;;
COLEGIO JORGE SOTO DEL CORRAL IED;860532537;Distrito Capital de Bogotá;Bogotá;;
ESTABLECIMIENTO PENITENCIARIO DE MEDIANA SEGURIDAD Y CARCELARIO DE BUENAVENTURA - INPEC;835000452;Valle del Cauca;Buenaventura;;
ICBF REGIONAL MAGDALENA;899999239;Magdalena;No Definido;;
EMPRESA SOCIAL DEL ESTADO HOSPITAL DE REPELON;802001292;Atlántico;Repelón;;
SENA REGIONAL QUINDIO Grupo de Apoyo Administrativo Mixto;899999034;Quindío;Armenia;;
ASAMBLEA DEPARTAMENTAL DE SANTANDER;800093948;Santander;Bucaramanga;;
ESTABLECIMIENTO PENITENCIARIO DE MEDIANA SEGURIDAD Y CARCELARIO DE TUMACO;840000137;Nariño;Tumaco;;
ALCALDIA LOCAL DE BOSA;8999990615;Distrito Capital de Bogotá;Bogotá;;
HOSPITAL FEDERICO LLERAS ACOSTA DE IBAGUE TOLIMA - EMPRESA SOCIAL DEL ESTADO;890706833;Tolima;Ibagué;;
VALLECAUCANA DE AGUAS S.A. E.S.P;900333452;No Definido;No Definido;;
FISCALÍA GENERAL DE LA NACIÓN REGIONAL CARIBE;800187568;Atlántico;Barranquilla;;
CONTRALORIA GENERAL DE LA REPUBLICA-GERENCIA RISARALDA;899999067;Risaralda;Pereira;;
ESTABLECIMIENTO PENITENCIARIO DE MEDIANA SEGURIDAD DE GARAGOA;820001016;Boyacá;Garagoa;;
INSTITUCION UNIVERSITARIA DE ENVIGADO;811000278;No Definido;No Definido;;
PERSONERÍA MUNICIPAL DE ZIPAQUIRA;832000349;Cundinamarca;Zipaquirá;;
MUNICIPIO DE TONA;890205581;Santander;Tona;;
ALCALDIA MUNICIPAL DE CHIA;899999172;Cundinamarca;Chía;;
DIRECCIÓN DE TRÁNSITO Y TRANSPORTE DE LA POLICÍA NACIONAL;830090486;Arauca;Arauca;;
EL INSTITUTO DE CULTURA EL CARMEN DE VIBORAL;900169143;Antioquia;Marinilla;;
CASA DEL VALLE- GOBERNACION DEL VALLE;8903990295;Distrito Capital de Bogotá;Bogotá;;
INSTITUTO COLOMBIANO AGROPECUARIO - SECCIONAL ANTIOQUIA;899999069;Antioquia;Bello;;
SENA REGIONAL CUNDINAMARCA Grupo Administrativo CAE;8999990341;Cundinamarca;Fusagasugá;;
INSTITUTO DE LA JUVENTUD EL DEPORTE Y LA RECREACION DE BUCARAMANGA;804002166;Santander;Bucaramanga;;
PERSONERÍA MUNICIPAL DE LA VICTORIA (VALLE DEL CAUCA);800100524;Valle del Cauca;La Victoria;;
FONDO NACIONAL AMBIENTAL - MADS;830025267;Distrito Capital de Bogotá;No Definido;;
ESCUELA DE AVIACION POLICIAL;809010745;Tolima;Mariquita;;
SECRETARIA DISTRITAL DE DESARROLLO ECONOMICO;899999061;Distrito Capital de Bogotá;Bogotá;;
CONCEJO MUNICIPAL DE CONVENCION;900107647;Norte de Santander;Convención;;
DEPARTAMENTO ADMINISTRATIVO DE LA DEFENSORIA DEL ESPACIO PUBLICO;899999061;No Definido;No Definido;;
INSTITUTO COLOMBIANO AGROPECUARIO - SECCIONAL RISARALDA;899999069;Risaralda;Dosquebradas;;
